{
  "$schema": "http://json-schema.org/draft-07/schema#",
  "title": "CATDAMS Telemetry Ingestion Payload",
  "type": "object",
  "required": [
    "agent_id",
    "session_id",
    "user_id",
    "timestamp",
    "messages",
    "metadata"
  ],
  "properties": {
    "agent_id": { "type": "string" },
    "session_id": { "type": "string" },
    "user_id": { "type": "string" },
    "timestamp": { "type": "string", "format": "date-time" },
    "messages": {
      "type": "array",
      "minItems": 1,
      "items": {
        "type": "object",
        "required": ["sequence", "sender", "text", "time"],
        "properties": {
          "sequence": { "type": "integer" },
          "sender": { "type": "string", "enum": ["user", "ai"] },
          "text":   { "type": "string" },
          "time":   { "type": "string", "format": "date-time" }
        }
      }
    },
    "metadata": {
      "type": "object",
      "required": ["agent_version","policy_version","os","application"],
      "properties": {
        "agent_version": { "type": "string" },
        "policy_version": { "type": "string" },
        "os": { "type": "string" },
        "application": { "type": "string" },
        "ip_address": { "type": "string", "format": "ipv4" },
        "language": { "type": "string" }
      },
      "additionalProperties": false
    }
  },
  "additionalProperties": false
}
