{
  "agent_id":     "agent-007",
  "session_id":   "sess-1234",
  "user_id":      "user-4321",
  "timestamp":    "2025-05-16T12:00:00Z",
  "messages": [
    {
      "sequence": 1,
      "sender":   "user",
      "text":     "Hello, CATDAMS!",
      "time":     "2025-05-16T12:00:01Z"
    }
  ],
  "metadata": {
    "agent_version":  "1.0.0",
    "policy_version": "2025-05",
    "os":             "Windows 10",
    "application":    "CATDAMS Sentinel",
    "ip_address":     "192.168.0.2",
    "language":       "en-US"
  }
}
